componente_id,tamaño_componente,id_articulo,titulo,autor,año
1,1415,4718,Robotics in the Resocialization of Youngsters and Teenagers in Socio-Educational Measures,Jussara Pancieri; Fábio Ventorim Siqueira; Márcia Gonçalves de Oliveira; Marcelo Cardoso Lima dos Santos,2019
1,1415,4731,Security and Cost Optimization Auditing for Amazon Web Services,Phan Duy Hung An Quoc Huy,2019
1,1415,4738,Service-Learning as a Lever to Support STEM Engagement for Underrepresented Youth,Joanna Totino Ardice Hartry Valeria F. Romero Rosio Pedroso Rosalinda Nava Melissa A. Collins,2019
1,1415,4754,Study TOUR for Computer Science Students,Henry C. B. Chan; H. V. Leong; Grace Ngai,2019
1,1415,4768,Teaching Research on Computer Programming based on Cultivation of Computational Thinking,Haiyan Ding,2019
1,1415,4773,The Canvas-Oriented Formalization of the Game Design Processes,Tetiana Luhova; Oleksandr Blazhko; Yuliia Troianovska; Oksana Riashchenko,2019
1,1415,4775,The Design of AR-based Virtual Educational Robotics Learning System,Fang-Chuan Ou Yang,2019
1,1415,4783,The Zeitgeist Juncture of “Big Data” and its Future Trends,Sanjay Kumar; Priyanka Gupta; Sachin Lakra; Lavanya Sharma; Ram Chatterjee,2019
1,1415,4791,The uniqueness of Computational thinking,P. Larsson; M-V. Apiola; M-J. Laakso,2019
1,1415,4807,Two computational formulae for similarity measures on intuitionistic fuzzy sets based on intuitionistic fuzzy equivalencies,Yingfang Li Limin Du Keyun Qin Xingxing He,2019
1,1415,4817,Using Topic Modeling to Extract Pre-Service Teachers’ Understandings of Computational Thinking From Their Coding Reflections,Maria Cutumisu; Qi Guo,2019
1,1415,482,Perspectives on cognitive informatics,Zhongzhi Shi; Jun Shi,2003
1,1415,483,SPADES - a distributed agent simulation environment with software-in-the-loop execution,Riley; Riley,2003
1,1415,4831,What Does Information Mean to Me as an Engineer? Fostering Engineering Students’ Holistic Competencies in the Informational World,Rosanna Yuen-Yan Chan; Vincent Yu Hang Choi; Qi Cao; Marco Lok Hin Wong; Sijie Yan; Cecilia Ka Yuk Chan,2019
1,1415,4844,Working on Language Processing,John Paul Mueller; Luca Massaron,2019
1,1415,4853,2 MACHINES THAT THINK,George Zarkadakis; Don Tapscott,2020
1,1415,4854,"4 On Humans, Artificial Intelligence, and Oracles",Digital Innovation; the Future of Work Year: 2020 | Book Chapter | Publisher: River Publishers,2020
1,1415,4857,7 AI FOR GOOD,George Zarkadakis; Don Tapscott,2020
1,1415,4859,A Application Study of Artificial Intelligence Aided Design,Shao Siyu,2020
1,1415,4863,A Deep Reinforcement Learning based Mobile Device Task Offloading Algorithm in MEC,Yang Li; Bing Shi,2020
1,1415,4868,A Hybridized Feature Extraction Approach To Suicidal Ideation Detection From Social Media Post,Faisal Muhammad Shah; Farsheed Haque; Ragib Un Nur; Shaeekh Al Jahan; Zarar Mamud,2020
1,1415,4879,A Survey of Sentiment Analysis from Social Media Data,Koyel Chakraborty; Siddhartha Bhattacharyya; Rajib Bag,2020
1,1415,488,"The Indian half of Needham's question: some thoughts on axioms, models, algorithms, and computational positivism",Roddam Narasimha,2003
1,1415,4880,A Survey on Challenges in Designing Cognitive Engines,Ali Mohammad Saghiri,2020
1,1415,489,The continuous-discrete interface - What does this really mean? Modelling and simulation issues,A.D. Brown; M. Zwolinski,2003
1,1415,4899,A new approach for association rules mining using computational and artificial intelligence,Markku Heikkilä Fahed Yoseph,2020
1,1415,4908,A robust machine learning approach to SDG data segmentation,Isaac Munyakazi Kassim S. Mwitondi; Barnabas N. Gatsheni,2020
1,1415,4909,A set theory based similarity measure for text clustering and classification,Ali A. Amer; Hassan I. Abdalla,2020
1,1415,4915,A thermo-elastoplastic self-consistent homogenization method for inter-granular plasticity with application to thermal ratcheting of TATB,Miroslav Zecevic Darby J. Luscher Kane C. Bennett; Ricardo A. Lebensohn,2020
1,1415,4918,AISec'20: 13th Workshop on Artificial Intelligence and Security,Nicholas Carlini Ambra Demontis Sadia Afroz,2020
1,1415,4921,Accelerating Business Growth with Big Data and Artificial Intelligence,Awishkar Ghimire; Surendrabikram Thapa; Avinash Kumar Jha; Surabhi Adhikari; Ankit Kumar,2020
1,1415,4949,Application and Research of Virtual Reality Technology Based on Big Data in College Teaching Field,Chengxia Zhang; Ying Li; Chengcheng Cai,2020
1,1415,4957,ArtMatch: Classifying Famous Paintings and Matching Them with Children’s Artwork,Ryan Z. Cheng,2020
1,1415,4958,Artificial intelligence and crime: A primer for criminologists,Matthijs M Maas Keith J Hayward,2020
1,1415,4975,Big Data security and privacy techniques,Anas Abou El Kalam Abdellah Ait Ouahman Lamia El Haourani,2020
1,1415,4982,Book Review: The Age of Disruption: Technology and Madness in Computational Capitalism,Mark Dawson,2020
1,1415,4983,Boundary crossing pedagogy in STEM education,Allen Leung,2020
1,1415,4989,Calculation of the Hubble Universe Expansion Constant by Analyzing Observational Data: An Exploratory Teaching Proposal based on STEM Epistemology,Apostolos Xenakis; Christos Xenakis; Sarantos Psycharis; Konstantinos Kalovrektis,2020
1,1415,499,/spl epsiv/-insensitive fuzzy c-regression models: introduction to /spl epsiv/-insensitive fuzzy modeling,J.M. Leski,2004
1,1415,4991,CatBoost for big data: an interdisciplinary review,John T. Hancock; Taghi M. Khoshgoftaar,2020
1,1415,4992,Centering the Identities of Girls of Color in Computational Thinking Programs,Patricia Garcia; Ashley Jackson; Laura-Ann Jacobs,2020
1,1415,4997,Co-Designing Machine Learning Apps in K–12 With Primary School Children,Tapani Toivonen; Ilkka Jormanainen; Juho Kahila; Matti Tedre; Teemu Valtonen; Henriikka Vartiainen,2020
1,1415,4998,Co-engineering of Safety and Security Life Cycles for Engineering of Automotive Systems,Helmut Martin Barbara Gallina Christoph Schmittner Robert Bramberger,2020
1,1415,5002,"Cold-based glaciation of Pavonis Mons, Mars: evidence for moraine deposition during glacial advance",Tomohiro Kanzaki Ryodo Hemmi Reid A. Parsons; Hideaki Miyamoto,2020
1,1415,5006,Comparing computational thinking skills of engineering students in urban and rural areas of Peru,Nicolas A. Nunez; Giuliana Cornejo-Meza; Sandro A. Sánchez,2020
1,1415,5009,Comparison of sort algorithms in Hadoop and PCJ,Marek Nowicki,2020
1,1415,501,A Review of Score Reliability: Contemporary Thinking on Reliability Issues,Gerald A Rosen,2004
1,1415,5019,Computational Thinking Growth During a First-Year Engineering Course,Noemi V. Mendoza Diaz; Russ Meier; Deborah A. Trytten; So Yoon Yoon,2020
1,1415,5039,Computational study on drilling mud flow through wellbore annulus by Giesekus viscoelastic model,Mahmood Norouzi Morsal Momeni Larimi Reza Rooki Mohammad Amir Hasani,2020
1,1415,5040,Computational thinking in school education in South America: Systematic review of the literature,Ronald Paucar Curasma; Herminio Paucar Curasma,2020
1,1415,5053,Creative Culinary Recipe Generation Based on Statistical Language Models,Willian Antô; nio dos Santos; João Ribeiro Bezerra; Luís Fabrício Wanderley Góes; Flávia Magalhães Freitas Ferreira,2020
1,1415,5056,Cultivating Positive ICT Perceptions: an application of the MST-tree model to the ‘Guyanese Girls Code’ Initiative,Alicia Layne; Penelope DeFreitas; Juanelle Marks; Rayad Lackhan,2020
1,1415,5057,Current landscape and influence of big data on finance,József Popp Md. Morshadul Hasan; Judit Oláh,2020
1,1415,5058,Cybersecurity data science: an overview from machine learning perspective,A. S. M. Kayes Shahriar Badsha Hamed Alqahtani Paul Watters Iqbal H. Sarker; Alex Ng,2020
1,1415,5064,DeConFuse: a deep convolutional transform-based unsupervised fusion framework,Jyoti Maggu Angshul Majumdar Emilie Chouzenoux Pooja Gupta; Giovanni Chierchia,2020
1,1415,5065,Deep Learning Models for Heterogeneous Big Data Analytics,Mohamed Elsayed; Hatem Abdelkader; Amira Abdelwahab,2020
1,1415,5069,DeepStealth: Game-Based Learning Stealth Assessment With Deep Neural Networks,Wookhee Min; Megan H. Frankosky; Bradford W. Mott; Jonathan P. Rowe; Andy Smith; Eric Wiebe; Kristy Elizabeth Boyer; James C. Lester,2020
1,1415,5070,Defining and Teaching Data Journalism: A Typology,Norman P. Lewis,2020
1,1415,5077,Designing Interaction and User Interface of Computational Thinking Digital Game for Children using User-Centered Design Approach,Nira Rizki Ramadhani; Adi Mulyanto; Ginar Santika Niwanputri,2020
1,1415,5083,Developing Computational Thinking for Children with Autism using a Serious Game,Menna Elshahawy; Mariam Bakhaty; Nada Sharaf,2020
1,1415,5084,Developing Computational Thinking through Project-Based Airplane Design Activities,Dazhi Yang; Youngkyun Baek; Steve Swanson,2020
1,1415,5106,Does it matter how well I know what you’re thinking? Opponent Modelling in an RTS game,James Goodman; Simon Lucas,2020
1,1415,5124,Encoding candlesticks as images for pattern classification using convolutional neural networks,Jun-Hao Chen; Yun-Cheng Tsai,2020
1,1415,5126,Engaging Estonian primary school children in computational thinking through adaptive educational games: A qualitative study,Liina Malva; Danial Hooshyar; Yeongwook Yang; Margus Pedaste,2020
1,1415,514,"Computational modelling of the unsaturated flow of liquid in heap leaching, using the results of column tests to calibrate the model",M. A. Mehrabian S. H. Mansouri A Sarrafi G. A. Sheikhzadeh,2004
1,1415,5146,Experimental and computational evidence for C=O π-bonding in [CH2OH]+ and related oxonium ions,William HC Martin Charles E Hudson David J McAdoo Richard D Bowen,2020
1,1415,5148,Exploration and Practice of Python Programming teaching model Based on MBO,Dongmei Wei; Xiuhua Wang; Ying Wang,2020
1,1415,5151,Exploring the Progression of Early Programmers in a Set of Computational Thinking Challenges via Clickstream Analysis,Andoni Eguíluz; Mariluz Guenaga; Pablo Garaizar; Cristian Olivares-Rodríguez,2020
1,1415,5152,"Exploring the Relationship Between Collaborative Discourse, Programming Actions, and Cybersecurity and Computational Thinking Knowledge",Bernard Yett; Caitlin Snyder; Nicole Hutchins; Gautam Biswas,2020
1,1415,5154,Exploring the key influencing factors on college students’ computational thinking skills through flipped-classroom instruction,Harrison H. Yang Di Gong; Jin Cai,2020
1,1415,5158,FDG PET versus CT radiomics to predict outcome in malignant pleural mesothelioma patients,M. Bogowicz J. Kraft D. Vuong M. Mayinger S. G. C. Kroeze M. Friess T. Frauenfelder N. Andratschke M. Huellner W. Weder M. Guckenberger S. Tanadini-Lang M. Pavic; I. Opitz,2020
1,1415,5159,FLAMES: A Socially Relevant Computing Summer Internship for High School Students,Amy Isvik; Veronica Cateté; Tiffany Barnes,2020
1,1415,5160,Factor space:a new idea for artificial intelligence based on causal reasoning,Qiwei Qiwei-Kong; Jing Jing-He; Peizhuang Peizhuang-Wang,2020
1,1415,5163,Finding Cracks in Shields: On the Security of Control Flow Integrity Mechanisms,Mingzhe Wang Chao Zhang Xingman Chen Songtao Yang Ying Liu Yuan Li,2020
1,1415,5165,Focus-Fight-Finalize (3F): Problem-Solving Steps Extracted From Behavioral Patterns in Block Based Programming,Suheda Mumcu Ünal Çakıroğlu,2020
1,1415,5168,Fostering computational thinking through educational robotics: a model for creative computational problem solving,Christian Giang Alberto Piatti Morgane Chevalier; Francesco Mondada,2020
1,1415,5174,From Gaming to Computational Thinking: An Adaptive Educational Computer Game-Based Learning Approach,Margus Pedaste Yeongwook Yang Liina Malva Gwo-Jen Hwang [...] View all Danial Hooshyar,2020
1,1415,5177,From the experimentation to the unification: how the transition to unified computer system ingluensed the professional culture of the soviet computer industry,Roman Abramov; Nadezhda Abramova,2020
1,1415,5181,Fuzzy Type-1 Triangular Membership Function Approximation Using Fuzzy C-Means,Muhammad Hamza Azam; Mohd Hilmi Hasan; Saima Hassan; Said Jadid Abdulkadir,2020
1,1415,5182,Fuzzy simplified swarm optimization for multisite computational offloading in mobile cloud computing,Obulaporam Gireesha Kannan Krithivasan V.S. Shankar Sriram [...] View all V. Meena,2020
1,1415,5214,In silico analysis of a novel causative mutation in Cadherin23 gene identified in an Omani family with hearing loss,Mazin Jawad Al-Khabouri Khalsa Ahmad Al-Lamki Flavia Palombo Tommaso Pippucci Giovanni Romeo Mohammed Nasser Al-Kindi; Nadia Mohammed Al-Wardy,2020
1,1415,5219,Innovation of Enterprise Economic Management Based on Artificial Intelligence Technology,Ma Qin,2020
1,1415,5220,Inquiry-Based Python Programming at Secondary Schools,J. Guniš; L. Šnajder; Z. Tkáčová; V. Gunišová,2020
1,1415,5239,LGIM: A Global Selection Algorithm Based on Local Influence for Influence Maximization in Social Networks,Liqing Qiu; Xiangbo Tian; Shiqi Sai; Chunmei Gu,2020
1,1415,524,Expert system algorithms for identifying radiated emission problems in printed circuit boards,H. Shim; T. Hubing; T. Van Doren; R. DuBroff; J. Drewniak; D. Pommerenke; R. Kaires,2004
1,1415,5243,Learning Culture and Computational Thinking in a Spanish Course: A Development Model,Debra A. L. Morrow Jennifer Curtis Shane Mitchell Shenghua Zha,2020
1,1415,5244,Learning Programming using Lego Mindstorms: Analysis of Learner Experiences,Farah Hanum Noor; Fitri Suraya Mohamad; Jacey Lynn Minoi,2020
1,1415,5249,Low-Cost Educational Robotics Car Promotes STEM Learning and 21st Century Skills,Sing Ling Ong; Jill Pei Wah Ling,2020
1,1415,5253,Machine Understandable Contracts with Deep Learning,Rares Dolga; Philip Treleaven; Mendes Thame Denny,2020
1,1415,5254,Machine learning for middle-schoolers: Children as designers of machine-learning apps,Henriikka Vartiainen; Tapani Toivonen; Ilkka Jormanainen; Juho Kahila; Matti Tedre; Teemu Valtonen,2020
1,1415,5259,Marketing research in China during the 40-year reform and opening,Yu Hu; Yonggui Wang,2020
1,1415,5266,Modelling of flowslides and debris avalanches in natural and engineered slopes: a review,Sabatino Cuomo,2020
1,1415,527,Increasing the probability of success in the first computer science course,F. Tadayon-Navabi; M.R. Anderson-Rowland; J.S. Collofello; D.L. Banks,2004
1,1415,5277,Natural Language Processing based Stochastic Model for the Correctness of Assamese Sentences,M. P. Bhuyan; S. K. Sarma; M. Rahman,2020
1,1415,5283,New Empiricisms in the Anthropocene: Thinking With Speculative Fiction About Science and Social Inquiry,Sarah E. Truman Elizabeth de Freitas,2020
1,1415,5303,Ontology of Social Machines,Brunno Wagner Lemos de Souza,2020
1,1415,5305,Optimizing Cyber Security Education: Implementation of Bloom’s Taxonomy for future Cyber Security workforce,Nageswaree Kodai Ramsoonder; Selvamanee Kinnoo; Anna J Griffin; Craig Valli; Nicola F. Johnson,2020
1,1415,5318,Personality-dependent content selection in natural language generation systems,Danielle S. Monteiro Ricelli M. S. Ramos; Ivandré Paraboni,2020
1,1415,5325,Pioneers on the Case for Promoting Motivation to Teach Text-Based Programming,Serkan Sendag Nuray Gedik Can Fatih Efecan,2020
1,1415,5333,Prediction of Leakage from an Axial Piston Pump Slipper with Circular Dimples Using Deep Neural Networks,Cem Sinanoğlu Abdullah Caliskan Özkan Özmen; Hasan Badem,2020
1,1415,5336,Pricing cloud IaaS computing services,Nicola Dimitri,2020
1,1415,5346,Providing Access and Opportunity for Computational Thinking and Computer Science to Support Mathematics for Students With Disabilities,Aman Yadav Emily C. Bouck,2020
1,1415,5357,Representation and Reasoning of Fuzzy Knowledge Under Variable Fuzzy Criterion Using Extended Fuzzy Petri Nets,Ruqi Zhou; Jiali Feng; Yiqun Chen; Huiyou Chang; Yuepeng Zhou,2020
1,1415,537,Predicting boiling heat transfer using computational fluid dynamics,M Wilson N A F Campbell G P Hammond M J Leathard J G Hawley,2004
1,1415,5375,Review of computational neuroaesthetics: bridging the gap between neuroaesthetics and computer science,Rui Li; Junsong Zhang,2020
1,1415,538,Problem solving based technical drawing education,P. Toth,2004
1,1415,5383,STEM Education Activities Development to Promote Computational Thinking’s Students,Pichet Srisangngam; Chaiyos Dechsura,2020
1,1415,5411,Still a New Kid on the Block? Computational Thinking as Problem Solving in Code.org,Jiangmei Yuan Ugur Kale,2020
1,1415,5413,Structural hole centrality: evaluating social capital through strategic network formation,Faisal Ghaffar; Neil Hurley,2020
1,1415,5415,Students’ problem-solving strategies in qualitative physics questions in a simulation-based formative assessment,Mihwa Park,2020
1,1415,5418,Supporting Teachers to Integrate Computational Thinking Equitably,Merijke Coenraad; Kelly Mills; Virginia L. Byrne; Diane Jass Ketelhut,2020
1,1415,5419,Survey on categorical data for neural networks,John T. Hancock; Taghi M. Khoshgoftaar,2020
1,1415,5426,Teaching Adversarial Machine Learning: Educating the Next Generation of Technical and Security Professionals,Edward J. Glantz Collin Payne,2020
1,1415,5428,Teaching Computational Thinking to Multilingual Students through Inquiry-based Learning,Sharin Jacob; Ha Nguyen; Leiny Garcia; Debra Richardson; Mark Warschauer,2020
1,1415,5431,Teaching Reform of Software Engineering Course Based on Computational Thinking,Xueyan Dong; Jingpeng Jia,2020
1,1415,5433,Teaching higher order thinking skills to gifted students: A meta-analysis,Li-Chuan Feng C Owen Lo,2020
1,1415,5434,Teaching reform of programming basic course based on SPOC blended teaching method,Xiaoying Li; Changlong Gu,2020
1,1415,5441,The Computational Thinking Scale for Computer Literacy Education,Jyh-Chong Liang Chung-Yuan Hsu Meng-Jung Tsai,2020
1,1415,5452,The Teaching Innovation and Research of Python Programming in Financial and Economic Universities,Xiang Fang,2020
1,1415,5453,The Teaching Mode and Practice Analysis of College Computer Basic Course Based on Computational Thinking,Chen Xue; Wang Zhun,2020
1,1415,5465,Think Fast: A Tensor Streaming Processor (TSP) for Accelerating Deep Learning Workloads,Dennis Abts; Jonathan Ross; Jonathan Sparling; Mark Wong-VanHaren; Max Baker; Tom Hawkins; Andrew Bell; John Thompson; Temesghen Kahsai; Garrin Kimmell; Jennifer Hwang; Rebekah Leslie-Hurd; Michael Bye; E.R. Creswick; Matthew Boyd; Mahitha Venigalla; Evan Laforge; Jon Purdy; Purushotham Kamath; Dinesh Maheshwari; Michael Beidler; Geert Rosseel; Omar Ahmad; Gleb Gagarin; Richard Czekalski; Ashay Rane; Sahil Parmar; Jeff Werner; Jim Sproch; Adrian Macias; Brian Kurtz,2020
1,1415,5467,Tools and Techniques for Teaching Computer Programming: A Review,Shampa Chakraverty Pinaki Chakraborty Kanika,2020
1,1415,5476,Tradeoff between Episodic and Semantic Precedents in creative design,Sichun Xue; Danni Shen; Enchang Zhang; Defu Bao,2020
1,1415,5477,Transition to Semi-Virtual Classrooms,Eltayeb S. Abuelyaman; Abdullah A. Manda,2020
1,1415,5486,Understanding the dynamics of biological and neural oscillator networks through exact mean-field reductions: a review,Marc Goodfellow Carlo R. Laing Christian Bick; Erik A. Martens,2020
1,1415,5496,Using MCDA for Selecting Criteria of LGPD Compliant Personal Data Security,Edna Dias Canedo Renato Carauta Ribeiro,2020
1,1415,5497,Using computational techniques to study social influence online,Richard Everson Mark Levine Miriam Koschate Alicia Cork,2020
1,1415,5504,Virtual/Mixed Reality Control of a Game Through Scratch,Nada Sharaf; Ghada Ahmed; Sama Ihab,2020
1,1415,5506,Visual block programming languages and their use in educational robotics,Pedro Plaza; Aruquia Peixoto; Elio Sancristobal; Manuel Castro; Manuel Blazquez; Antonio Menacho; Félix García-Loro; German Carro; Javier Muñoz; Mónica Muñoz; Alejandro Muñoz; Sara Muñoz; César Muñoz; Blanca Quintana; Africa Lopez-Rey,2020
1,1415,5517,Why I Do Not Talk About Computational Thinking in Journalism Classes: Sorry (Not Really Sorry),Kayt Davies,2020
1,1415,5518,"Z*-Numbers, Data Structures, and Thinking in Machine-Mind Architecture",Romi Banerjee; Sankar K. Pal,2020
1,1415,5531,8 Computational Heterogeneity: A Radical Reflection,Pratim Sengupta; Amanda Dickes; Amy Voss Farris,2021
1,1415,5538,A Computational-thinking-oriented Progressive Teaching Mode for Python Course,Haodong Ren; Li Yang; Liheng Jiang; Yu Bai; Wei Lu; Jie Chang,2021
1,1415,5554,A Reference Architecture for Validating Security Across Multi-Cloud Computing Systems,Henry Edet,2021
1,1415,5555,A Revaluation of Computational Thinking in K–12 Education: Moving Toward Computational Literacies,Chris Proctor Yasmin B. Kafai,2021
1,1415,5561,A Study on Student's Perspective on Use of social media in Education,Khundrakpam Anjalee Devi; Md. Rezaul Karim; Kavneet Kaur Sodhi; Rachna Bansal,2021
1,1415,5565,A Typology of Models for Integrating Computational Thinking in Science (CT+S),Ari Krakowski; Eric Greenwald; Meghan Comstock; Natalie Roman; Jacob Duke,2021
1,1415,5567,A bayesian network model for machine learning and cyber security,Gabriel Kabanda,2021
1,1415,5580,A fuzzy computational approach for selecting interdependent projects using prioritized criteria,Gulshan Kumar Majdi Beseiso,2021
1,1415,5590,A model of on/off transitions in neurons of the deep cerebellar nuclei: deciphering the underlying ionic mechanisms,Hugues Berry; Stéphane Genet,2021
1,1415,5596,A primer on deep learning and convolutional neural networks for clinicians,Pablo Sanz Bellón Amaia Pérez del Barrio Pablo Menéndez Fernández-Miranda David Rodríguez González José A. Vega Andrés A. González Mandly Lara Lloret Iglesias; José A. Parra Blanco,2021
1,1415,5602,A survey on artificial intelligence assurance,Laura Freeman Feras A. Batarseh; Chih-Hao Huang,2021
1,1415,5603,A survey on data‐efficient algorithms in big data era,Amina Adadi,2021
1,1415,5619,Adapting an OER Textbook for the Inverted Classroom Model — How To Flip the Classroom with BBC micro:bit Example Tasks,Oliver Kastner-Hauler; Karin Tengler; Heike Demarle-Meusel; Barbara Sabitzer,2021
1,1415,5623,Adversarial Machine Learning Attacks and Defense Methods in the Cyber Security Domain,Asaf Shabtai Yuval Elovici Lior Rokach Ishai Rosenberg,2021
1,1415,5628,Alzheimer Disease Classification Using Transfer Learning,Heta Acharya; Rutvik Mehta; Dheeraj Kumar Singh,2021
1,1415,5635,An Engineering Computational Thinking Diagnostic: A Psychometric Analysis,Noemi V. Mendoza Diaz; Deborah A. Trytten; Russ Meier; So Yoon Yoon,2021
1,1415,5636,An Evaluation of Container Security Vulnerability Detection Tools,Salman Toor Omar Javed,2021
1,1415,5645,An associational study: preschool teachers’ acceptance and self-efficacy towards Educational Robotics in a pre-service teacher training program,Cristina Valls-Bautista Anna Borrull-Riera Mireia Usart Despoina Schina; Vanessa Esteve-González,2021
1,1415,5649,An insight into Alzheimer’s disease and its on-setting novel genes,Sivaloganathan Anogh Muthukumar Mohamed Shafras Jaanaky Vigneswaran; Geetika Pant,2021
1,1415,5665,Annotating and detecting topics in social media forum and modelling the annotation to derive directions-a case study,Josette Jones Sumam Mary Idicula Anand Kulanthaivel B. Athira; Enming Zhang,2021
1,1415,568,Agent-Based Geographical Information System,O.L. Monteiro de Farias; N. dos Santos,2005
1,1415,5685,Artificial intelligence with deep learning in nuclear medicine and radiology,Jens Maebe Roel Van Holen Milan Decuyper; Stefaan Vandenberghe,2021
1,1415,5695,A computational model of argumentation schemes for multi-agent systems,Peter McBurney Rafael H. Bordini Alison R. Panisson,2021
1,1415,5704,"Book Review: Simon Lindgren, Data Theory: Interpretive Sociology and Computational Methods",Alexander Halavais,2021
1,1415,5706,Bounded-Rational Pursuit-Evasion Games,Yue Guan; Dipankar Maity; Christopher M. Kroninger; Panagiotis Tsiotras,2021
1,1415,5707,Bringing AI to the clinic: blueprint for a vendor-neutral AI deployment infrastructure,Edwin Bennink Christian P. Mol Hugo J. Kuijf Tim Leiner; Wouter B. Veldhuis,2021
1,1415,5708,Build your own robot,Pedro Plaza; Manuel Castro; Elio Sancristobal; Félix García-Loro; Rosario Gil; Antonio Menacho; Manuel Blázquez; Blanca Quintana; Sergio Martin; Francisco Mur; Alejandro Macho; Pablo Baizán; Ramón Carrasco; German Carro; África López-Rey; Clara Pérez; Russ Meier; Edmundo Tovar,2021
1,1415,5714,Celebrity profiling through linguistic analysis of digital social networks,Alexandra Pomares-Quimbaya Luis G. Moreno-Sandoval; Jorge A. Alvarado-Valencia,2021
1,1415,5719,Characterization of point-spread function specification error on Geometric Transfer Matrix partial volume correction in [11C]PiB amyloid imaging,Davneet S. Minhas Sarah K. Royse Howard J. Aizenstein Ann D. Cohen Dana L. Tudorascu Charles M. Laymon; William E. Klunk,2021
1,1415,5725,Co-design Center for Exascale Machine Learning Technologies (ExaLearn),James Ang Jenna A Bilbrey Jan Balewski Tiernan Casey Ryan Chard [...] View all Francis J Alexander,2021
1,1415,5727,Coding Club: a K-12 good practice for a STEM learning community,Stavroula Misthou; Nektarios Moumoutzis; Dimitrios Loukatos,2021
1,1415,5731,Comparative analysis of box-covering algorithms for fractal networks,Marcell Nagy Péter Tamás Kovács; Roland Molontay,2021
1,1415,5743,Computational Thinking Through an Empirical Lens: A Systematic Review of Literature,Jessica S. C. Leung Ndudi O. Ezeamuzie,2021
1,1415,5745,Computational Thinking and Block-Based Programming for Beginning Engineering Students: Systematic Review of the Literature,Ronald Paucar Curasma; Klinge Orlando Villalba-Condori; Nolan Jara Jara; Rosa Quispe Llamoca; Julio Cesar Cabrera Chávez; María Del Pilar Ponce-Aranibar,2021
