componente_id,tamaño_componente,id_articulo,titulo,autor,año
4,57,5347,Pushing Boundaries: How Coding Is (and Isn’t) Taught in Accredited Journalism Programs,Katherine A. Bradshaw James C. Foust,2020
4,57,5522,1 Beyond Technocentrism: Coding as Experience,Pratim Sengupta; Amanda Dickes; Amy Voss Farris,2021
4,57,5607,AI business model: an integrative business approach,Shrutika Mishra; A. R. Tripathi,2021
4,57,561,A Perceptual Model for Sinusoidal Audio Coding Based on Spectral Integration,Armin Kohlrausch Richard Heusdens Jesper Jensen Steven van de Par; Søren Holdt Jensen,2005
4,57,5716,Change that Respects Business Expertise: Stories as Prompts for a Conversation about Organisation Security,Simon Arnell Jeremy Ward Simon Parkin,2021
4,57,5739,Computational Models for Workload Analysis of Driving Tasks,Deborah Thompson Holly Handley,2021
4,57,618,Research on the computation model of macro block coding based on the rate-distortion optimization,Zhang Jian; Yu Sheng-sheng; Li Xuan Yuan,2005
4,57,6431,ASPIDA: An Observatory for Security and Privacy in the Greek e-Business Sector,Gerasimos Katevas Ioannis Katsidimas Emmanouil Kerimakis Sotiris Nikoletseas Stefanos Panagiotou Paul Spirakis Vasileios Vlachos,2022
4,57,6566,Computer-based Simulation Data Model for Employment of Business Management Talents in Colleges: Python Implementations,Shaohui Fang,2022
4,57,6744,Increasing returns and business cycles in a family of Goodwinian models with Leontiev technology,Alexander V. Ryzhenkov,2022
4,57,7143,A Security-Evaluation Framework for Mobile Cross-Border e-Government Solutions,Bernd Prunster Christian Kollmann Andreea Ancuta Corici + 3 Thomas Zefferer,2023
4,57,7326,Comparative Analysis of Quality Assurance Models for Business Excellence: with special reference to ISO 9001 and EFQM model,Rajneesh Mishra,2023
4,57,7391,Data or Business First?—Manufacturers’ Transformation Toward Data-driven Business Models,Björn Häckel Daniel Leuthe Bastian Stahl; Christian Ritter,2023
4,57,7505,Explainability as a Method for Learning From Computers,Martin Klimo; Jaroslav Kopčan; L’ubomír Králik,2023
4,57,7516,Exploring investor-business-market interplay for business success prediction,Xingquan Zhu Divya Gangwani; Borko Furht,2023
4,57,810,"Finite element analysis of crustal deformation in the Ou Backbone Range, northeastern Japan, with non-linear visco-elasticity and plasticity: effects of non-uniform thermal structure",Kazuteru Garatani Bunichiro Shibazaki; Hiroshi Okuda,2007
4,57,8114,Adding Constructs to ‘C’ Through Flex and Bison,Nachiketh Arroju; Nallabothula Vamsi; N. Yeshwanth Reddy; Meena Belwal,2024
4,57,8622,Integrating Coding into Liberal Arts Education: An Action-Research Approach for Enhancing Digital and Disciplinary Skills,Margherita Maria Sacco; Alberto Parola,2024
4,57,8979,The potential of neuroscience in transforming business: a meta-analysis,Supriya Khaneja; Tushar Arora,2024
4,57,907,Computational Models of Facial Attractiveness Judgments,Judith H Langlois Richard Russell P Matthew Bronstad,2008
4,57,917,Coupling techniques for computational non-linear transient aeroelasticity,M C Haupt P Horst R Unger,2008
4,57,9444,Fenics: A Modular Framework for Security Evaluation in Decentralized Federated Learning,Sifat Nawrin Nova Romaric Duvignau Carla Fabiana Chiasserini Shubham Saha,2025
4,57,9713,Scaling hermeneutics: a guide to qualitative coding with LLMs for reflexive content analysis,Zackary Okun Dunivin,2025
4,57,9779,The role of non-coding RNAs (ncRNAs) and their potential connection with cancer,Safura Absalan; Hamidreza Vaziri,2025
4,57,978,The Computational Detection of Functional Nucleotide Sequence Motifs in the Coding Regions of Organisms,Michael Krasnitz Arnold J. Levine Harlan Robins,2008
5,51,1135,Ontology-Based Categorization of Web Search Results Using YAGO,Anjian Ren; Xiaoyong Du; Puwei Wang,2009
5,51,1261,Comparing an FPGA to a Cell for an Image Processing Application,Hau Ngo Randy P. Broussard Ryan N. Rakvic; Robert W. Ives,2010
5,51,1298,Estimating Watermarking Capacity in Gray Scale Images Based on Image Complexity,Farzin Yaghmaee; Mansour Jamzad,2010
5,51,166,Book Review: Learning and Computational Neuroscience: Foundations of Adaptive Networks,Geoffrey Hall,1994
5,51,1715,Assessing the Efficacy of Dynamic Adaptive Planning of Infrastructure: Results from Computational Experiments,Warren E Walker Vincent A W J Marchau Jan H Kwakkel,2012
5,51,1748,Concretizing the image schema: How semantics guides the bootstrapping of syntax,Sushobhan Nayak; Amitabha Mukerjee,2012
5,51,1925,Adaptive constrained CM-based multicarrier-CDMA receivers in multipath fading channels,Jun-Da Chen; Ye-Shun Shen,2013
5,51,2114,Super-resolution for simultaneous realization of resolution enhancement and motion blur removal based on adaptive prior settings,Daisuke Izumi Akane Yoshizaki Takahiro Ogawa; Miki Haseyama,2013
5,51,2278,Efficient robust image interpolation and surface properties using polynomial texture mapping,Mingjing Zhang; Mark S Drew,2014
5,51,2331,Learning search polices from humans in a partially observable context,Guillaume de Chambrier; Aude Billard,2014
5,51,2349,Multiframe adaptive Wiener filter super-resolution with JPEG2000-compressed images,Russell C Hardie Barath Narayanan Narayanan; Eric J Balster,2014
5,51,2553,Complex adaptive systems approach to sewol ferry disaster in Korea,SunHee Yoo HyungSun Yoo DongKyu Won; JongYeon Lim,2015
5,51,2808,Using Image Processing on MRI Scans,Chetan Patil; M G Mathura; S Madhumitha; S Sumam David; Merwyn Fernandes; Anand Venugopal; B. Unnikrishnan,2015
5,51,3031,MetaFusion: An efficient metasearch engine using genetic algorithm,Daya Gupta; Devika Singh,2016
5,51,3116,Stopping criterion for linear anisotropic image diffusion: a fingerprint image enhancement case,Mohammad A. U. Khan Yinan Kong Tariq M. Khan; Omar Kittaneh,2016
5,51,3306,Cuckoo search via Lévy flights for the capacitated vehicle routing problem,Samantha Tapucar Cinmayii Manliguez Jon Henly Santillan; Vicente Calag,2017
5,51,3472,Semantic Search-by-Examples for Scientific Topic Corpus Expansion in Digital Libraries,Hussein T. Al-Natsheh; Lucie Martinet; Fabrice Muhlenbach; Fabien Rico; Djamel A. Zighed,2017
5,51,4004,RETRACTED ARTICLE: A method for spectral image registration based on feature maximum submatrix,Huiqin Wang Meng Wu Zhan Wang Ke Wang; Jialin Liu,2018
5,51,453,Book Review: Adaptive Thinking: Rationality in the Real World,Earl Hunt,2003
5,51,4552,Image steganography based on color palette transformation in color space,Eugenijus Margalikas; Simona Ramanauskaitė,2019
5,51,4687,RETRACTED ARTICLE: Research on image correction method of network education assignment based on wavelet transform,Weiwei Hu,2019
5,51,4856,68Ga-PSMA-11 PET/MRI: determining ideal acquisition times to reduce noise and increase image quality,Raven L. Smith Dora H. Tao Courtney A. Lawhn-Heath Dave E. Korenchan Peder E. Z. Larson Robert R. Flavell Vishnu Murthy; Thomas A. Hope,2020
5,51,5376,Review on Image Processing Based Adversarial Example Defenses in Computer Vision,Meikang Qiu; Han Qiu,2020
5,51,565,Adaptive DFT-Based Interferometer Fringe Tracking,Ettore Pedretti Jesse Bregman Robert W. Mah Edward Wilson; Wesley A. Traub,2005
5,51,5916,Geometric-algebra affine projection adaptive filter,Yongfeng Zhi Yuetao Ren; Jun Zhang,2021
5,51,5935,II-20: Intelligent and pragmatic analytic categorization of image collections,Jan Zahálka; Marcel Worring; Jarke J. Van Wijk,2021
5,51,5991,Location probability learning in 3-dimensional virtual search environments,Victoria Interrante Caitlin A. Sisk; Yuhong V. Jiang,2021
5,51,6069,Output-Bounded and RBFNN-Based Position Tracking and Adaptive Force Control for Security Tele-Surgery,Xiangjun Ji Aiguo Song Kurosh Madani Amine Chohra Huimin Lu Ramon Monero Ting Wang,2021
5,51,615,Registration-Based Range-Dependence Compensation for Bistatic STAP Radars,Fabian D. Lapierre; Jacques G. Verly,2005
5,51,6315,Using DFS Search and Enumerate Method to Find All Solutions in 13 Convex Figures in Tangram Game,Hongbo Wang,2021
5,51,6498,Beyond Algorithmic Bias: A Socio-Computational Interrogation of the Google Search by Image Algorithm,Arwa M. Mboya Orestis Papakyriakopoulos,2022
5,51,656,An Attention-Driven Model for Grouping Similar Images with Image Retrieval Applications,Liam M Mayron Gustavo B Borba Oge Marques; Humberto R Gamba,2006
5,51,659,Blind Adaptive Channel Equalization with Performance Analysis,Shiann-Jeng Yu; Fang-Biau Ueng,2006
5,51,6591,DIPPAS: a deep image prior PRNU anonymization scheme,Sara Mandelli Paolo Bestagini Vincenzo Lipari Francesco Picetti; Stefano Tubaro,2022
5,51,6697,Feature Discrimination of News Based on Canopy and KMGC-Search Clustering,Mobeen Shahroz; Muhammad Faheem Mushtaq; Rizwan Majeed; Ali Samad; Zaigham Mushtaq; Urooj Akram,2022
5,51,703,Learning-Based Nonparametric Image Super-Resolution,Mithun Das Gupta Nemanja Petrovic Shyamsundar Rajaram; Thomas S. Huang,2006
5,51,706,"Logarithmic Adaptive Neighborhood Image Processing (LANIP): Introduction, Connections to Human Brightness Perception, and Application Issues",J-C Pinoli; J Debayle,2006
5,51,718,On the Perceptual Organization of Image Databases Using Cognitive Discriminative Biplots,Nikolaos A. Laskaris George Economou Christos Theoharatos; Spiros Fotopoulos,2006
5,51,7442,Dynamic spatiotemporal correlation coefficient based on adaptive weight,Chunzhi Tan Weiguo Zhang Guoli Mo; Xuezeng Yu,2023
5,51,772,Accelerating of Image Retrieval in CBIR System with Relevance Feedback,Nenad Kojić Vladan Radosavljević Maja Rudinac Stevan Rudinac Nikola Reljin Irini Reljin Goran Zajić; Branimir Reljin,2007
5,51,7786,RILS-ROLS: robust symbolic regression via iterated local search and ordinary least squares,Aleksandar Kartelj; Marko Djukanović,2023
5,51,8042,A Method for Accelerating Encrypted Data Search in Laravel Applications Using a Coded Search Parameter,A. Muratovic; A. Tanovic,2024
5,51,813,Geometric Approach to Nonlinear Adaptive Control,Jozsef K. Tar; Imre J. Rudas,2007
5,51,824,Iterative Desensitisation of Image Restoration Filters under Wrong PSF and Noise Estimates,Guillermo Cisneros Miguel A. Santiago; Emiliano Bernués,2007
5,51,8469,Enriching Conversations: Empowering ChatGPT with Image Caption Generation,Rahul Chowdary K Eagalapati; M Chaitanya Chowdary; Addepalli Sai Sasank; Busam Monish; Pallavi R Kumar,2024
5,51,8602,Improving the learning-teaching process through adaptive learning strategy,Leticia Castano Sadie Lissette Guerrero Solis Omar Olmos Lopez Carlos Felipe Rodríguez Hernández Laura Angélica Castillo Lara Elvira G. Rincon-Flores; Laura Patricia Aldape Valdés,2024
5,51,8933,Text-Driven Image Editing Based on Diffusion Models,Xinyu Wu,2024
5,51,8977,The metabolic hypothesis for restrictive eating behaviors: A computational and evolutionary approach,Giuseppe Pierpaolo Merola Gaia Maiolini Eleonora D’Areglia Valdo Ricca Giovanni Castellini Livio Tarchi,2024
5,51,9249,Can internet search data predict human migration intentions?,Holly E. Reed Haodong Qi; Pieter Bevelander,2025
5,51,9551,Investigation of TsGAN-based multimodal image fusion to augment image pre-processing abilities,Priyanka Bhatambarekar; Gayatri Phade,2025
5,51,9710,Runtime Stealthy Perception Attacks against DNN-based Adaptive Cruise Control Systems,Anqi Chen Maxfield Kouzel Haotian Ren Morgan McCarty + 2 Xugui Zhou,2025
6,46,2156,Whither (away) Software Engineers in SBSE?,Christopher L. Simons,2013
6,46,3385,Improvement of students abilities for quality of software through personal software process,Sobia Mansoor; Arifa Bhutto; Neelma Bhatti; Noorulain aamir Patoli; Mudassar Ahmed,2017
6,46,3518,The dividends of investing in computational software design: A case study,Petros Tzeferacos Don Q Lamb Anshu Dubey,2017
6,46,3585,A Note on Subgroup Security in Pairing-Based Cryptography,Tadanori Teruya,2018
6,46,3621,A measurement system for capacitive PUF-based security enclosures,Vincent Immler Matthias Hiller Georg Sigl Johannes Obermaier,2018
6,46,3650,An Approach for the Inception of Security Testing in the Early Stages of Software Development,Neha Mahendra; Mohammad Muqeem,2018
6,46,3671,Architectural Solutions to Mitigate Security Vulnerabilities in Software Systems,Jungwoo Ryoo Priya Anand,2018
6,46,3838,Evaluating the degree of security of a system built using security patterns,Nobukazu Yoshioka Hironori Washizaki Eduardo B. Fernandez,2018
6,46,3901,Internet Security Liberated via Software Defined Exchanges,Richard R. Brooks Geddings Barrineau Jonathan Oakley + 2 Kuang-Ching Wang,2018
6,46,4002,Quantitative security assurance metrics,Nishu Prasher Basel Katt,2018
6,46,4101,Session details: Session 3: Security and Safety Analysis,Simon Foley,2018
6,46,4104,Session details: System software and security: EMBS - embedded systems track,Marco Di Natale Li-Pin Chang,2018
6,46,4105,Session details: System software and security: OS - operating systems track,George Hamer Jaeheung Lee Bongjae Kim,2018
6,46,4106,Session details: System software and security: SEC - computer security track,Lieven Desmet Giampaolo Bella,2018
6,46,4107,Session details: System software and security: SiSoS - software-intensive systems-of-systems track,Flavio Oquendo Axel Legay Thais Vasconcelos Batista Khalil Drira,2018
6,46,4116,Software security vulnerabilities,Pete Rotella,2018
6,46,4240,5 SOFTWARE ENGINEERING,Peter J. Denning; Matti Tedre,2019
6,46,4433,Cyberspace Security and U.S.-China Relations,Xuming Qian,2019
6,46,4593,Learning Software Security in Context,Basel Katt Shao-Fang Wen,2019
6,46,4606,Managing security risks,Maritta Heisel Roman Wirtz,2019
6,46,4724,"Security - Visible, Yet Unseen?",Marie-Laure Zollinger Carine Lallemand Peter B. Roenne + 2 Verena Distler,2019
6,46,4761,Systems Engineering and Software Engineering,Richard E. Fairley,2019
6,46,4860,A Comparison Study of Available Sofware Security Ontologies,Hamid Abdul Basit Faraz Idris Khan Maham Anwar Beg Mamdouh Alenezi,2020
6,46,4910,"A study on the prevalence of human values in software engineering publications, 2015 -- 2018",Waqar Hussain Jon Whittle Arif Nurwidyantoro Davoud Mougouei Rifat Ara Shams Gillian Oliver Harsha Perera,2020
6,46,4953,Applications of AI in classical software engineering,Jonas Rebstadt Marco Barenkamp; Oliver Thomas,2020
6,46,5085,Developing Software Using Agile and Design Thinking Framework,Mahrukh Sameen Mirza; Soma Datta,2020
6,46,5398,Security by Design in Software Engineering,Mark Kreitz,2020
6,46,5485,Understanding Software Security from Design to Deployment,Matthias Galster Laurie Williams Mehdi Mirakhorli,2020
6,46,5608,AI for Security and Security for AI,Murat Kantarcioglu Cuneyt Gurcan Akcora Sagar Samtani + 2 Elisa Bertino,2021
6,46,5698,Better security through obfuscation,Chris Edwards,2021
6,46,5794,Design of Java Interactive System Pattern based on Computational Thinking,Jian Yang,2021
6,46,5940,Improvement of Learning Outcomes in Software Engineering: Active Methodologies Supported Through the Virtual Campus,Alicia García-Holgado; Andrea Vázquez-Ingelmo; Francisco J. García-Peñalvo; MªJosé Rodríguez Conde,2021
6,46,6148,SE-First: A New Approach to Software Engineering Education,Colin Maly; Suzette Person; Leen-Kiat Soh,2021
6,46,6198,Structuring a comprehensive software security course around the OWASP application security verification standard,Nusrat Zahan Val Kozarev Rui Shu Tim Menzies Laurie Williams Sarah E. Elder,2021
6,46,6840,On the Educational and Professional Implications of Integrating Mind Mapping in Software Testing,Pankaj Kamthan; Nazlie Shahmir,2022
6,46,6939,Revolutionary transformations in twentieth century: making AI-assisted software development,Binayak Parashar; Inderjeet Kaur; Anupama Sharma; Pratima Singh; Deepti Mishra,2022
6,46,7000,Sustainability is a Security Problem,Patrick Drew McDaniel,2022
6,46,7094,Voting Item: Story-work in human-centric software engineering,Austen Rainer; Catherine Menon,2022
6,46,7746,Paradigm Shift From Monolithic to Microservices,Divarshana Saxena; Biswajit Bhowmik,2023
6,46,7752,Perceptions of Practitioners on Security-Related Software Testing in a Mobile Software Development Company,Jéssyka Vilela Mariana Peixoto Diogo Santos Carla Silva Alexandre Soares,2023
6,46,776,Adopting Software Engineering Trends in AI,Dragan Djuric; Vladan Devedzic; Dragan Gasevic,2007
6,46,7848,Security Responses in Software Development,Helen Sharp Arosha Bandara Thein Tun Mark Levine + 1 Tamara Lopez,2023
6,46,8743,On the Security Blind Spots of Software Composition Analysis,Shawn Rasheed Alexander Jordan Tim White Jens Dietrich,2024
6,46,8776,Poor Security and Safety,Jonathan Grudin Ronald M. Baecker,2024
6,46,894,An Innovative Approach to Teaching an Undergraduate Software Engineering Course,Cynthia Y. Lester,2008
6,46,9509,"IDAC-Dose 2.2, an internal dosimetry software for diagnostic nuclear medicine based on the latest ICRP adult and paediatric reference computational phantoms",Keith Eckerman Martin Andersson; Sören Mattsson,2025
7,46,1030,Analyzing production modifications of a C-130 engine repair facility using simulation,Jeremy D. Jordan; Sharif H. Melouk; Paul D. Faas,2009
7,46,1086,Fuzzy Presumptive Rate of Aggregative Risk in Software Development,Huey-Ming Lee; Lily Lin,2009
7,46,110,Thinking with Numbers: An Informal Look,Mun-Bing Chow John Trinkaus,1990
7,46,1164,Small (Poly)Unsaturated Oxygen Containing Ions and Molecules: A Brief Assessment of Their Thermochemistry Based on Computational Chemistry,Karl J. Jobst Johan K. Terlouw John L. Holmes,2009
7,46,1379,"Review Essay: The Rising of the “Body, Glorified”; John D. Sykes, Jr. Flannery O'Connor, Walker Percy, and the Aesthetic of Revelation.; The Body in Flannery O'Connor's Fiction: Computational Technique and Linguistic Voice.; The Abbess of Andalusia: Flannery O'Connor's Spiritual Journey",J. Robert Baker,2010
7,46,1704,An appreciation of John Pollock's work on the computational study of argument,John Horty Henry Prakken,2012
7,46,1705,An economic and ecological perspective of ethanol production from renewable agro waste: a review,Sonia Johri Latika Bhatia; Rumana Ahmad,2012
7,46,1800,Modeling the operational risk in Iranian commercial banks: case study of a private bank,Alimohammad Kimiagari Omid Momen; Eaman Noorbakhsh,2012
7,46,1914,A novel risk-based analysis for the production system under epistemic uncertainty,Fereshteh Khalaj Mehran Khalaj; Amineh Khalaj,2013
7,46,2004,"Effects of water domains on seismic wavefields: A simulation case study at Taal volcano, Philippines",Yuta Maeda; Hiroyuki Kumagai,2013
7,46,2070,Multiple imputation using chained equations for missing data in TIMSS: a case study,Donia Smaali Bouhlila; Fethi Sellaouti,2013
7,46,2143,Transcriptome analysis of leaf and root of rice seedling to acute dehydration,Duk-Ju Hwang Jong-Seong Jeon Baek Hie Nahm Pham-Thi Minh-Thu; Yeon-Ki Kim,2013
7,46,216,Computational imagery and diagrammatic reasoning: a case study in kinematics,P. Olivier; K. Nakata,1996
7,46,2292,Fuzzy logic-based sport activity risk assessment framework optimization,Edit Tóth-Laufer,2014
7,46,2399,Research on the calculation method of information security risk assessment considering human reliability,Tingyang Gu; Luyi Li; Minyan Lu; Jiao Li,2014
7,46,2626,Fodder crop re-allocation sustainability and risk efficiency,Kheiry Hassan M Ishag,2015
7,46,2698,Optimizing sawing of boards for furniture production using CT log scanning,Magnus Fredriksson,2015
7,46,2816,18th European Symposium on Radiopharmacy and Radiopharmaceuticals,J. W. Engle C. Roy J. Griswold M. F. Nortier E. R. Birnbaum M. Brugh S. Mirzadeh K. D. John M. E. Fassbender Chuangyan Zhai Gerben M. Franssen Milos Petrik Peter Laverman Clemens Decristoforo Ait-Mohand Samia… V. Radchenko,2016
7,46,3070,Personal and related kinds of proximity driving collaborations: a multi-case study of Dutch nanotechnology researchers,Ward Ooms Claudia Werker; Marjolein C. J. Caniëls,2016
7,46,3872,High frequency audiometry in tinnitus patients with normal hearing in conventional audiometry,Hesham S. Kozou Doaa M. Elmoazen; Alaa A. Mohamed,2018
7,46,3917,Linked Rule-Premises to Optimize the Fuzzy-Based Risk Assessment,Edit Tóth-Laufer,2018
7,46,4098,Self-Organizing Cooperative Dynamics in Government Extended Enterprises,Lawrence John; Georganne Brier John; Matthew Parker; Brian J. Sauser; Jon P. Wade,2018
7,46,4353,Assessing the risk of default propagation in interconnected sectoral financial networks,Alejandro Martínez Alex Arenas Pablo Fleurquin Jordi Nin José J. Ramasco Adrià Barja; Elena Tomás,2019
7,46,4638,On the computational realization of formal ontologies: Formalizing an ontology of instantiation in spacetime using Isabelle/HOL as a case study,Thomas Bittner,2019
7,46,5023,Computational Treatments to Recover Erased Heritage: A Legacy of Slavery Case Study (CT-LoS),Lori A. Perine; Rajesh Kumar Gnanasekaran; Phillip Nicholas; Alexis Hill; Richard Marciano,2020
7,46,5162,"Fear, Anger, and Political Advertisement Engagement: A Computational Case Study of Russian-Linked Facebook and Instagram Content",Toby Hopp Chris J. Vargo,2020
7,46,5263,Meso–macro-scale computational analysis of boron nitride nanotube-reinforced aluminium and epoxy nanocomposites: A case study on crack propagation,Ankit Gupta Gaurav Arora Himanshu Pathak Ramesh G Burela Anant S Bhatnagar Srikant Padmanabhan,2020
7,46,5269,More Than Just Good Passwords? A Study on Usability and Security Perceptions of Risk-based Authentication,Markus Dürmuth Luigi Lo Iacono Stephan Wiefling,2020
7,46,5515,What risk? I don't understand. An Empirical Study on Users' Understanding of the Terms Used in Security Texts,Rongjunchen Zhang Wanlun Ma Sheng Wen Xin Xia Cecile Paris Surya Nepal Yang Xiang Tingmin Wu,2020
7,46,5595,A passenger risk assessment method based on 5G-IoT,Yifeng Huang Hao Yang Jing Li Weishi Chen; Xianfeng Lu,2021
7,46,5703,Bits Under the Mattress: Understanding Different Risk Perceptions and Security Behaviors of Crypto-Asset Users,Artemij Voskobojnikov Konstantin Beznosov Rainer Böhme Svetlana Abramova,2021
7,46,5943,In silico analysis of promoter regions and regulatory elements (motifs and CpG islands) of the genes encoding for alcohol production in Saccharomyces cerevisiaea S288C and Schizosaccharomyces pombe 972h-,Jemal Aman Beshir; Mulugeta Kebede,2021
7,46,6176,Small-scale analysis to rank municipalities requiring slow-moving landslide risk mitigation measures: the case study of the Calabria region (southern Italy),Gianfranco Nicodemo Settimio Ferlisi Luigi Borrelli Giovanni Gullà; Dario Peduto,2021
7,46,6879,Predicting subjective well-being in a high-risk sample of Russian mental health app users,Larisa Mararitsa Semen Sorokin Olessia Koltsova Polina Panicheva; Paolo Rosso,2022
7,46,6997,Surgical face masks do not impair the decoding of facial expressions of negative affect more severely in older than in younger adults,Maja Guseva Katja Wagemans Doris Pischedda John-Dylan Haynes Georg Jahn Lea Henke; Silke Anders,2022
7,46,7142,A SafeML extension for a unified risk assessment to diverse service robots,Yoshihiro Nakabo Hidetoshi Fukui Makoto Yashiro Iko Miyazawa Takeshi Sakamoto Noriaki Ando Toru Kuga Atsushi Kitamura Kenichi Ohara Takao Miyoshi; Tetsuya Kimura,2023
7,46,7834,Scalable approach for high-resolution land cover: a case study in the Mediterranean Basin,José F. Aldana-Martín María Vázquez-Pendón Cristóbal Barba-González Yaiza Jiménez Gómez Virginia García Millán Antonio Manuel Burgueño; Ismael Navas-Delgado,2023
7,46,8185,Aurora Kinase A inhibition enhances DNA damage and tumor cell death with 131I-MIBG therapy in high-risk neuroblastoma,Jessica Koach Erin Nekritz Sucheta Mukherjee Benjamin S. Braun Steven G. DuBois Nicole Nasholm Daphne Haas-Kogan Katherine K. Matthay William A. Weiss Clay Gustafson Prerna Kumar; Youngho Seo,2024
7,46,8739,Novel embeddings improve the prediction of risk perception,Rui Mata Zak Hussain; Dirk U. Wulff,2024
7,46,8866,Security Risk Assessment on Cloud: A Systematic Mapping Study,Alexandra Sheykina Fabio Palomba Andrea De Lucia Gemma Catolino + 1 Giusy Annunziata,2024
7,46,8922,Systemic risk assessment of Lithuanian second-pillar pension funds through connectedness and spillover,Audrius Kabašinskas,2024
7,46,910,"Computational Toxicology—Risk Assessment for Pharmaceutical and Environmental Chemicals Edited by Sean Ekins Publisher: Wiley-Interscience, John Wiley & Sons, Inc. 2007. 814 pages ISBN: 978-0-470-04962-4. 814 pages. Price: $140.00.",John A. Budny,2008
7,46,9193,Analysis of China's grain production from the perspective of food security and suggestions for increasing grain production,Kai Yang Xuanke Wang,2025
7,46,9484,Genetic variants of leptin receptor gene (rs1137101) and obesity risk in prakriti individuals and its pathogenicity prediction using in silico approaches,Sourav Musib Yogesh Vetriselvan Ilangovan Karthiga Artchoudane Soccalingam Melissa Shaelyn Samuel Irisappan Ganesh Manoranjani Murugan; Sambandam Ravikumar,2025
7,46,9576,Logical Reasoning with LLMs via Few-Shot Prompting and Fine-Tuning: A Case Study on Turtle Soup Puzzles,Donghao Huang; Zhaoxia Wang,2025
7,46,9595,Mitigate authentication attack risk on cancelable biometrics by leveraging attacker knowledge,Rima Ouidad Belguechi; Chistophe Rosenberger,2025
8,44,1037,Aspects of planning support for human-agent coalitions,Clauirton de Albuquerque Siebra; Natasha Correia Queiroz Lino,2009
8,44,1160,Simulation & Implementation of Shortest Path Algorithm with a Mobile Robot Using Configuration Space Approach,T. C. Manjunath; B. G. Nagaraja; Ashok Kusagur; Gopala,2009
8,44,1408,The relevance of universal metrics in relation to human aesthetic perception,Azlan Iqbal,2010
8,44,1437,A Framework for teaching electromagnetic concepts using mobile devices,Daniel R. Browne; Simon C. Pomeroy; James A. Flint,2011
