componente_id,tamaño_componente,id_articulo,titulo,autor,año
1,1415,7571,"Get in Researchers; We're Measuring Reproducibility"": A Reproducibility Study of Machine Learning Papers in Tier 1 Security Conferences",Allison Lu Carson Stillman Kevin Warren + 5 Daniel Olszewski,2023
1,1415,7580,Hash-Based Convolutional Deep-thinking Pattern Classifier,Chao Wang; Zhihong Man; Jiong Jin; Wenjie Ye,2023
1,1415,7590,How Useful TutorBot+ is for Teaching and Learning in Programming Courses: a Preliminary Study,Claudia Martínez-Araneda; Mariella Gutiérrez Valenzuela; Pedro Gómez Meneses; Diego Maldonado Montiel; Alejandra Segura Navarrete; Christian Vidal-Castro,2023
1,1415,7591,"How are primary school computer science curricular reforms contributing to equity? Impact on student learning, perception of the discipline, and gender gaps",Barbara Bruno Catherine Audrin Morgane Chevalier Sunny Avry Jessica Dehler Zufferey Laila El-Hamamsy; Francesco Mondada,2023
1,1415,7593,How to Develop CT Skills Using Robotics Projects Combined with Arts - a Pilot Study,K. Miková; Z. Kubincová,2023
1,1415,7603,ISpliter: an intelligent and automatic surface mesh generator using neural networks and splitting lines,Shizhao Chen Xiang Gao Xiang Zhang Chunye Gong Chuanfu Xu Zengsheng Liu; Jie Liu,2023
1,1415,7635,Integrating Computing in High School Curriculum: A Conceptual Approach,Priti Kulkarni; Rajashree Jain,2023
1,1415,7636,Integrating Satellites and Mobile Edge Computing for 6G Wide-Area Edge Intelligence: Minimal Structures and Systematic Thinking,Yueshan Lin; Wei Feng; Ting Zhou; Yanmin Wang; Yunfei Chen; Ning Ge; Cheng-Xiang Wang,2023
1,1415,7641,Integration of computational thinking in K-12 mathematics education: a systematic review on CT-based mathematics instruction and student learning,Biyao Liang Oi-Lam Ng Huiyan Ye; Ching Sing Chai,2023
1,1415,7662,John Clark's Latin Verse Machine: 19th Century Computational Creativity,Mike Sharples,2023
1,1415,7666,Language evolution and computational capabilities: conceptualization of the first language units,Said Boutiche,2023
1,1415,7679,"Literacy, numeracy, and problem-solving skills of adults with disabilities in STEM fields",Kristin Mansell Teresa Lansford J Jacob Kirksey,2023
1,1415,768,A cybernetic approach to multi-agent system simulation in Tijuana-San Diego using the Viable Systems Model,S.J. Jones; A. Rodriguez-Diaz; L. Hall; M. Castanon-Puga; D.L. Flores-Gutierrez; C. Gaxiola-Pacheco,2007
1,1415,7683,Machine Learning with Explainability for Suicide Ideation Detection from Social Media Data,Md Rafiqul Islam; Md. Kowsar Hossain Sakib; Shanjita Akter Prome; Xianzhi Wang; Anwaar Ulhaq; Cesar Sanin; David Asirvatham,2023
1,1415,7696,Methods of Data Mining and Their Industrial Applications,Yedilkhan Amirgaliyev; Beibut Amirgaliyev; Perizat Omarova,2023
1,1415,7697,Mimicking biological synapses with a-HfSiOx-based memristor: implications for artificial intelligence and memory applications,Maria Rasheed Chandreswar Mahata Myounggon Kang Muhammad Ismail; Sungjun Kim,2023
1,1415,7702,Modified state activation functions of deep learning-based SC-FDMA channel equalization system,Hassan A. Hassan Mohamed H. Essai Hamada Esmaiel Ahmed S. Mubarak Mohamed A. Mohamed; Osama A. Omer,2023
1,1415,7706,"Motivational climate predicts effort and achievement in a large computer science course: examining differences across sexes, races/ethnicities, and academic majors",Margaret Ellis Fei Gu Brett D. Jones; Hande Fenerci,2023
1,1415,7707,"Multi-National Cyber Security Exercise, Case Flagship 2",Jani Paijanen Tuomo Sipola Tero Kokkonen,2023
1,1415,7708,Multimedia generation using neural network DeepDream,Komala C R; Krishan Kumar Bhushan; Prasanna Hridaynadan Anthony; Hussainkhan A Jahagirdar; Apurva Mahadore; Syed Mustafa,2023
1,1415,7713,Mutational signatures for breast cancer diagnosis using artificial intelligence,Harrison Okello Annette Wakaanya Clabe Wekesa Patrick Odhiambo; Patrick Okoth,2023
1,1415,7719,Networks of climate change: connecting causes and consequences,Petter Holme; Juan C. Rocha,2023
1,1415,7721,Neural Network for Musical Data Mining for Phrase Boundary Detection,Daniel Henel; Aleksander Mazur; Marcin Retajczyk; Weronika T. Adrian; Krzysztof Kluza; Adrian Horzyk,2023
1,1415,7724,Neuroeducation: Guidelines for Computational Thinking training,Cristiana Araújo; Pedro Rangel Henriques; João José Cerqueira,2023
1,1415,7751,Perceived masculinity from Facebook photographs of candidates predicts electoral success,Kunwoo Park; Jungseock Joo,2023
1,1415,7758,"Playing, tinkering, and problem solving: Understanding early computational thinking in libraries and museums",J Elizabeth Mills Kathleen Campana,2023
1,1415,7764,Power surge: How a multistakeholder coalition promotes equity in computer science education policy,Joel Knudson Candice Handjojo Ashley Sunde Roxana Hadad Julie Flapan,2023
1,1415,7767,Prediction Analysis Of Four Disease Risk Using Decision Tree C4.5,Nabilla Rahayu Rusyana; Faiza Renaldi; Dea Destiani,2023
1,1415,7771,ProRobot: An Experience Report of an Introduction to Programming and Robotics Course,Thabatta Moreira Alves De Araújo; Anderson Ribeiro De Oliveira Santos Silva; Alisson Marques Da Silva; Eduardo Habib Bechelane Maia; Michel Pires Da Silva,2023
1,1415,7776,Promoting K-12 Computer Science Education : A Computational Thinking Partnership Project,Jiang Li; Jennifer Cuddapah; Marisel Torres-Crespo; Ann Stewart; Anthony Williams,2023
1,1415,7780,Psychological Stress Assessment System under Big Data Analysis Technology,Ping Xiao; Li Li,2023
1,1415,7782,Quantifying participation biases on social media,Benjamin A. Valentino Neeti Pokhriyal; Soroush Vosoughi,2023
1,1415,7787,ROMSS: a rational optional multi-secret sharing scheme based on reputation mechanism,Yuling Chen Chaoyue Tan Yun Luo Ruonan Shi; Tao Li,2023
1,1415,7799,Redefining the Performance Management using Emotional Artificial Intelligence,P. Govindasamy; R. Sankar Ganesh; R. Ramesh,2023
1,1415,7805,Repeated Builds During Code Review: An Empirical Study of the OpenStack Community,Rungroj Maipradit; Dong Wang; Patanamon Thongtanunam; Raula Gaikovina Kula; Yasutaka Kamei; Shane McIntosh,2023
1,1415,7806,Repo-Educ: Repository of Educational Robotics Lesson Plans,Aylane Santos Pereira; Merciana Gonçalves Pereira Moura; Luiz Marcos Garcia Gonçalves; Carla Da Costa Fernandes Curvelo,2023
1,1415,7809,Research on Automobile Sales Forecasting Model Based on Data Mining and Cloud Computing,Fan Yang,2023
1,1415,7814,Research on Intelligent Control System of Landscape Ecology Based on Computer Virtual Reality Technology,Ren Wang,2023
1,1415,7817,Research on the Application of Gamification Programming Teaching for High School Students’ Computational Thinking Development,ZhiWei Qu; JiaMing Liu; Lu Che; YanXiu Su; Wei Zhang,2023
1,1415,7820,Resource allocation and network pricing based on double auction in mobile edge computing,Syed Bilal Hussian Shah Saeeda Usman Saoucene Mahfoudh Fathima Shemim KS Xiao Zheng; Piyush Kumar Shukla,2023
1,1415,7826,Reward Shaping for Happier Autonomous Cyber Security Agents,Vasilios Mavroudis Chris Hicks Elizabeth Bates,2023
1,1415,7827,Role of Artificial Intelligence in mode of Diabetic Retinopathy Imaging Techniques: A Review Artificial Intelligence in Diabetic Retinopathy,Alpana Kumari; Vivek Kumar Garg,2023
1,1415,783,Blind PARAFAC Signal Detection for Polarization Sensitive Array,Xiaofei Zhang; Dazhuan Xu,2007
1,1415,7833,Scaffolding CT via Point-And-Click and P5.js,Andrea Valente; Emanuela Marchetti; Edward Abel,2023
1,1415,784,Board Representations for Neural Go Players Learning by Temporal Difference,Helmut A. Mayer,2007
1,1415,7840,SecTL '23: Proceedings of the 2023 Secure and Trustworthy Deep Learning Systems Workshop,818 28 2,2023
1,1415,7844,Securing the Flow: Security and Privacy Tools for Flow-based Programming,Vaios Bolgouras Christos Xenakis Ilias Politis Thodoris Ioannidis,2023
1,1415,7845,Security Analysis of the 3MF Data Format,Vladislav Mladenov Juraj Somorovsky Jost Rossel,2023
1,1415,7853,Self-Efficacy to Train Computational Thinking Skills in Pre-Service Teachers*,Fabiola Talavera-Mendoza; Fabian Hugo Rucano Paucar; Diego Antonio Urdanivia Alarcón,2023
1,1415,7856,Semantic temporality analysis: A computational approach to time in English and German texts,Marius Sältzer Kohei Watanabe,2023
1,1415,7857,Sentence Level Analysis for Detecting Mental Health Causes Using Social Media Posts,Abm Adnan Azmee; Manohar Murikipudi; Md Abdullah Al Hafiz Khan; Yong Pei,2023
1,1415,7860,Sequential Behavior Analysis of Interdisciplinary Activities in Computational Thinking and EFL Learning With Game-Based Learning,Ting-Chia Hsu; Ching Chang; Yi-Sian Liang,2023
1,1415,7863,Simcan2Cloud: a discrete-event-based simulator for modelling and simulating cloud computing infrastructures,Alberto Núñez Adrián Bernal M. Emilia Cambronero Pablo C. Cañizares; Adam Barker,2023
1,1415,7868,Social Media in Emerging Economies: A Cross-Cultural Comparison,Thomas F. Stafford; Bao Q. Duong,2023
1,1415,7869,Social navigation hypothesis of depressive disorder disproven,Marcin Piotr Nowak,2023
1,1415,788,Cognitive Informatics Foundations of Nature and Machine Intelligence,Yingxu Wang,2007
1,1415,7880,Students’ Engagement in Computational Thinking Skills Using A Game Based-Learning,Rif’Ati Dina Handayani; Srihandono Budi Prastowo; Jamalludin; Triyanto; Mohammad Anas Thohir,2023
1,1415,7881,Study on Teaching Programming in Adult Colleges Based on the Cultivation of Computational Thinking,Jiefei Chen,2023
1,1415,7882,Studying social networks in the age of computational social science,Xinwei Xu,2023
1,1415,7893,"Sustainable refugee camp design in the Dalhamyie settlement (Bekaa, Lebanon) for climate change context",Nibal Al Azzawi Pallavi Tiwari; Lübna Amir,2023
1,1415,7895,Systematic Review on Humanizing Machine Intelligence and Artificial Intelligence,Juby Abraham; George Joseph Cherian; N. Jayapandian,2023
1,1415,7899,Tango: Rethinking Quantization for Graph Neural Network Training on GPUs,Shiyang Chen; Da Zheng; Caiwen Ding; Chengying Huan; Yuede Ji; Hang Liu,2023
1,1415,7900,Teachers' Perception and Experiences of Computer Science Education in K-8 Schools,Vaibhav Anu; Sumi Hagiwara; Katherine Herbert; Kazi Zakia Sultana; Minsun Shin; Rebecca Goldstein; Patricia Virella,2023
1,1415,7901,Teaching Multiplicative Thinking With Virtual Representations to Children With Mathematics Difficulty,Stephanie D. Sigmon MEd Rajiv Satsangi PhD,2023
1,1415,7902,Teaching and Learning Computational Thinking Through Game-Based Learning: A Systematic Review,Mengmeng Cheng Xinfeng Li Xinyue Wang,2023
1,1415,7909,The Beautiful Rule: Thinking the Aesthetics of Game Rules,Miguel Sicart,2023
1,1415,791,Complex problem solving with reinforcement learning,Frederic Dandurand; Thomas R. Shultz; Francois Rivest,2007
1,1415,7911,The Deep Sleep Optimizer: A Human-Based Metaheuristic Approach,Sunday O. Oladejo; Stephen O. Ekwe; Lateef A. Akinyemi; Seyedali A. Mirjalili,2023
1,1415,7914,The Effects of Flipped Classroom on Learning Achievement in Block-Based Programming Education,Victor Wan-Chong Choi; Huey Lei; António José Mendes,2023
1,1415,7915,The Effects of Worked-Out Example and Metacognitive Scaffolding on Problem-Solving Programming,Jaewon Jung Joerg Zumbach Eunseon Yi Yoonhee Shin,2023
1,1415,7917,The Impact of Playing Multiplayer Online Battle Arena Video Games on the Enhancement of Computational Thinking Skills Among Students in Indonesia,Athaillah Adhar Jumana; Josua Golden Umboh; K I Ketut Dharma Wijaya; Alexander Agung Santoso Gunawan; Karen Etania Saputra,2023
1,1415,7918,The Impact of stem Courses on Students’ Computational Thinking: Mediation based on problem solving ability and stem attitude,Jiaying Zhang; Yi Zhang; Yuru Lin,2023
1,1415,792,Computational Fluency Performance Profile of High School Students With Mathematics Disabilities,Robert Wall Emerson Margaret Flores David E. Houchins Mary Beth Calhoon,2007
1,1415,7922,The Psychological Impact of TikTok on Mental Health,Jovana Dudukovic; Souliyany Gnotsyoudom; Oleksandra Tryzna; Yazan Mahmoud Qandeel; Andrea Tick,2023
1,1415,7923,The Reform and Practice of College Computer Basic Courses Towards Computational Thinking and Empowerment Education Under the Background of New Liberal Arts,Shiguang Zhang; Xiaonan Fang; Feng Yuan; Ting Zhou,2023
1,1415,7930,The computational thinking for science (CT-S) framework: operationalizing CT-S for K–12 science education researchers and educators,Eric Greenwald Sara Allan Matthew A. Cannady Ari Krakowski Lauren Brodsky Melissa A. Collins Ryan Montgomery Timothy Hurt; Rena Dorph,2023
1,1415,7934,The evolution of Big Data in neuroscience and neurology,Paola Gonzalez-Mego Ciro Ramos-Estebanez Lauren Hana Zukowski Rahul Mikkilineni Richard Jarrett Rushmore Laura Dipietro; Timothy Wagner,2023
1,1415,7944,The “algorithmic as if”: Computational resurrection and the animation of the dead in Deep Nostalgia,Paul Frosh Sara Kopelman,2023
1,1415,7950,"Time series big data: a survey on data stream frameworks, analysis and algorithms",Susana Brás Susana Sargento Ana Almeida; Filipe Cabral Pinto,2023
1,1415,7951,To Think Like a Vertex (or Not) for Distributed Training of Graph Neural Networks,Varad Kulkarni; Akarsh Chaturvedi; Pranjal Naman; Yogesh Simmhan,2023
1,1415,7956,Towards a Hermeneutics of Computational Thinking in Wing’s Approximations,Juan González-Martínez Marta Peracaula-Bosch,2023
1,1415,7960,Towards the Assessment of Basic Computational Thinking Skills Using Syntactic Analysis Techniques,Antonio Gonzalez-Torres; Elliot Ramirez-Trejos; Lilliana Sancho-Chavarria; Jose Navas-Su; Cesar Garita; Jorge Monge-Fallas,2023
1,1415,7964,Training Topology With Graph Neural Cellular Automata,Daniel Dwyer; Maxwell M. Omwenga,2023
1,1415,798,Computational modelling of convective heat transfer in a simulated engine cooling gallery,M Wilson M J Leathard J G Hawley K Robinson,2007
1,1415,7985,Using Epistemic Network Analysis to Explore Primary School Students’ Computational Thinking in Pair Programming Learning,Shuwen Wang Xiaohong Liu Yu-Sheng Su,2023
1,1415,7986,Using Open Technology to Bring Computational Thinking Activities to the Outdoors,Opey Adeyemi; Bowen Hui,2023
1,1415,799,Computational modelling of the extrusion of an Al-SiC metal matrix composite using macroscale and microscale methods,B. P O'Donnell J. P McGarry P. E McHugh D. E Ilie,2007
1,1415,8,Man-Computer Symbiosis,J. C. R. Licklider,1960
1,1415,8007,What Else Can Be Learned When Coding? A Configurative Literature Review of Learning Opportunities Through Computational Thinking,Georgie Tarling Taro Fujita Judith Kleine Staarman Ana Melro,2023
1,1415,8011,You Will Perish: A Case Study of Serendipitous Literacies and Novice Video Game Design,Bradley Robinson,2023
1,1415,8014,"“Content Is Meaningless, and Structure Is All-Important”: Defining the Nature of Computer Science in the Age of High Modernism, c. 1950–c. 1965",David Nofre,2023
1,1415,8031,A Critical Review of Primary School Students’ Difficulties in Learning Programming Through Educational Games,Stelios Xinogalos Andreas Giannakoulas,2024
1,1415,8041,A Mathematical Theory to Price Cyber-Cat Bonds Boosting IT/OT Security,Bodhibrata Nag Ranjan Pal,2024
1,1415,8053,A Study on Undergraduate Engineering Research,Kleio Avrithi; Dionyssia Clagett,2024
1,1415,8056,A Survey on the Applications of Semi-supervised Learning to Cyber-security,Paula Branco Guy-Vincent Jourdan Herna Lydia Viktor Paul Kiyambu Mvula,2024
1,1415,806,Emotional Agent Based on Rough Set,Jun Hu; Yu-hai Chen; Chun Guan,2007
1,1415,8063,A brief review of noncoding RNA,Suja Subramanian Tina P. George; M. H. Supriya,2024
1,1415,808,"Ethnicity, Religion, and Residential Segregation in London: Evidence from a Computational Typology of Minority Communities",Allan J Brimicombe,2007
1,1415,8087,AI Embodiment Through 6G: Shaping the Future of AGI,Lina Bariah; Mérouane Debbah,2024
1,1415,8098,AISec '24: Proceedings of the 2024 Workshop on Artificial Intelligence and Security,Xinyun Chen Matthew Jagielski Maura Pintor,2024
1,1415,8111,Adaptive Self-Reflection as a Social Media Self-Effect: Insights from Computational Text Analyses of Self-Disclosures of Unreported Sexual Victimization in a Hashtag Campaign,Tsz Hang Chu Tien Ee Dominic Yeo,2024
1,1415,8116,Advancing Equity and Access: Addressing the Side Effects of Broadening Participation in Computer Science K–12 Education,Rebecca Zarch Sarah Dunton Tia c. Madkins Katelin Trautmann [...] View all Joshua Childs,2024
1,1415,8121,Adversarial Threats in Machine Learning: A Critical Analysis,Suman Chahar; Sonali Gupta; Isha Dhingra; Kuldeep Singh Kaswan,2024
1,1415,8122,Afterword: Thinking futures,Bryan S. Turner,2024
1,1415,8124,American politics in 3D: measuring multidimensional issue alignment in social media using social graphs and text data,Duncan Cassells Zografoula Vagena Jean-Philippe Cointet Pedro Ramaciotti; Michael Bailey,2024
1,1415,8128,An Early Detection of Parkinson’s Disease using Machine Learning and Deep Learning Models,Shagun Sharma; Kalpna Guleria; Rajni Sobti,2024
1,1415,8135,An In-Depth Analysis on Mitigating Data Breaches in Healthcare Systems through Big Data Structure,Luke Martin Achacoso Alden Christian Amper Alesandra Leonina Eco Mary Jane Samonte,2024
1,1415,8150,Analysis of Sentiment Toward Computer Science in Pre-University Education,Rafael Herrero-Álvarez; Enrique Callejas-Castro; Gara Miranda; Coromoto León,2024
1,1415,8152,Analysis of the Windows Control Flow Guard,Patrick Kochberger Niels Pfau,2024
1,1415,8153,Analysis on dendritic deep learning model for AMR task,Sanli Zhu Yang Yu Ziqian Wang Peng Yin; Zhuangzhi Chen,2024
1,1415,8154,Analyzing narrative contagion through digital storytelling in social media conversations: An AI-powered computational approach,Zexin Ma Rong Ma Xinyan Zhao,2024
1,1415,8156,Analyzing the Effectiveness of Reflection Prompts Accompanying Cybersecurity Assignments Using Natural Language Processing,Cheryl Resch; Christina Gardner-McCune,2024
1,1415,8159,"Anti-Alzheimer potential of Solanum lycopersicum seeds: in vitro, in vivo, metabolomic, and computational investigations",Omnia Hesham Abdelhafez Abeer H. Elmaidomy Hanan F. Aly Eman A. Younis Mubarak A. Alzubaidi Naseh A. Algehainy Faisal H. Altemani Mohammed Majrashi Faisal Alsenani Gerhard Bringmann Usama Ramadan Abdelmohsen Hussain T. Bakhsh; Fatma Alzahraa Mokhtar,2024
1,1415,8165,Application of MATLAB and SAS Viya AI models towards the elucidation of potential microplastics in the Neuse River Basin,Kyle Nowlin Olubunmi Ayodele Wesley A. Williams; Shyam Aravamudhan,2024
1,1415,817,"If You Build Teachers, Will Students Come? The Role of Teachers in Broadening Computer Science Learning for Urban Youth",Joanna Goode,2007
1,1415,8171,Artificial Intelligence and historical thinking: a dialogic exploration of ChatGPT / Inteligencia Artificial y pensamiento histórico: una exploración dialógica del ChatGPT,Elisa Gartner Mario Carretero,2024
1,1415,8181,Assessment of Convolutional Neural Networks for Dementia Diagnosis through MR Images,Jyoti Kumari; Santi Kumari Behera; Prabira Kumar Sethy,2024
1,1415,8186,Automated Feedback in Software Engineering: Enhancing Computational Thinking Process,Faraz Parsa; Amir Ali Amiri Moghadam; Turaj Ashuri,2024
1,1415,8189,Automating board-game based learning. A comprehensive study to assess reliability and accuracy of AI in game evaluation,Federica Pelizzari Marilena di Padova Francesco Palladino Giordano Vignoli Anna Dipace Andrea Tinterri,2024
1,1415,8193,Bayesian hierarchical network autocorrelation models for estimating direct and indirect effects of peer hospitals on outcomes of hospitalized patients,Guanqing Chen; A. James O’Malley,2024
1,1415,8202,Blockchain meets machine learning: a survey,Safak Kayikci; Taghi M. Khoshgoftaar,2024
1,1415,8208,Bringing computational thinking into classrooms: a systematic review on supporting teachers in integrating computational thinking into K-12 classrooms,Zarina Gearty Eleanor Richard Chandra Hawley Orrill Shakhnoza Kayumova Zhichun Liu; Ramprasad Balasubramanian,2024
1,1415,8212,CCSW '24: Proceedings of the 2024 on Cloud Computing Security Workshop,Paolo Palmieri Apostolos Fournaris,2024
1,1415,8218,CPSS '24: Proceedings of the 10th ACM Cyber-Physical System Security Workshop,Sudipta Chattopadhyay Jianying Zhou,2024
1,1415,8221,CSCS '24: Proceedings of the 2024 Cyber Security in CarS Workshop,Christoph Krauß Hans-Joachim Hof Mario Fritz,2024
1,1415,8222,CSET '24: Proceedings of the 17th Cyber Security Experimentation and Test Workshop,773 22 7,2024
1,1415,8250,Collaborative Learning in K-12 Computational Thinking Education: A Systematic Review,Dion Hoe-Lian Goh Choon Lang Quek Stella Xin Yin,2024
1,1415,8260,Comparing discrete choice and machine learning models in predicting destination choice,Ilona Rahnasto; Martijn Hollestelle,2024
1,1415,8263,Comparitive study of LSTM and Ensemble models for Hindi text sentiment analysis,Vishal Hanuman; Kevin Noel; Shravani Vangur; R Shankar,2024
1,1415,8271,Computational Metaphor Processing: A Review,Manisha Rana; Rita Chikkara; Srishti Sharma,2024
1,1415,8274,Computational Thinking in Asia-Pacific K-12 STEAM Education: A Systematic Review,Qian Tan; Sdenka Zobeida Salas-Pilco,2024
1,1415,8275,Computational Thinking in Game-Based Learning for STEM Education,Noor Affieyka Natasha Ahamad; Ismassabah Ismail; Nurul Hidayah Mat Zain; Marina Ismail,2024
1,1415,8276,Computational analysis of electrical stimulation to promote tissue healing for hernia repair at varying mesh placement planes,German Berbel Elizabeth A Friis Savannah Mosier,2024
1,1415,8285,Computational cross-media research: tracing divergences between normative Dutch television and social media discourses on the ‘refugee crisis’ (2013-2018),Thomas Poell Anne Helmond Bernhard Rieder Jasmijn Van Gorp Emillie de Keulenaar,2024
1,1415,8291,Computational optimisation and modelling of sacrificial anode placement and dimension for maximising the corrosion prevention of screw piles,Seyed Farshid Chini Peyman Taheri Abraham Mansouri Mohammad Javad Shirshahi,2024
1,1415,830,Measuring Semantic Similarity in Wordnet,Xiao-Ying Liu; Yi-Ming Zhou; Ruo-Shi Zheng,2007
1,1415,8301,Conditional computation in neural networks: Principles and research trends,Alessandro Baiocchi Alessio Devoto Valerio Marsocci Pasquale Minervini Jary Pomponi Simone Scardapane,2024
1,1415,8327,Cyber-Flashing Identification Method of Analysing Human Skin on Social Media Platforms,Karpagam M; Thomas M. Chen; Mithileysh Sathiyanarayanan,2024
1,1415,8341,"Deep Learning in Autonomous Vehicles: A Comprehensive Review of Object Detection, Lane Detection and Scene Perception",Pulluru Likhitha; Harshith Kalyanam; Sai Sri Krishna Teja Sanku; Godwin Ponsam. J,2024
1,1415,8371,Developing Future Computational Thinking in Foundational CS Education: A Case Study From a Liberal Education University in India,Balaji Kalluri; Prajish Prasad; Prakrati Sharma; Divyaansh Chippa,2024
1,1415,8372,"Developing Programming Competencies in School-Students With Block-Based Tools in Chile, Ecuador, and Peru",Cristian Vidal-Silva; Jesennia Cárdenas-Cobo; Miguel Tupac-Yupanqui; Jorge Serrano-Malebrán; Aurora Sánchez Ortiz,2024
1,1415,8383,Development of Artificial Intelligence,Jianjun Zhang; Jing Li,2024
1,1415,8396,Discovering Programming Talent and Improving Learning Motivation with CodeCombat in K-12 Education,Wan Chong Choi; Iek Chong Choi,2024
1,1415,8397,Disentangling degree and tie strength heterogeneity in egocentric social networks,Gerardo Iñiguez János Kertész Sara Heydari; Jari Saramäki,2024
1,1415,8398,Do 3–8 Years Old Children Benefit From Computational Thinking Development? A Meta-Analysis,Kan Kan Chan Qianru Li Shing On Leung Xiaowen Wang,2024
1,1415,8401,Does computational thinking really have an impact on academic performance? A systematic review,Pinghong Zhou; Yumin Tang; Yi Zhang; Yue Yu; Yixin Li,2024
1,1415,8406,"Dynamical systems, literary theory, and the computational modelling of narrative",Federico Pianzola,2024
1,1415,8411,Early Detection and Prevention of Malicious User Behavior on Twitter Using Deep Learning Techniques,Rubén Sánchez-Corcuera; Arkaitz Zubiaga; Aitor Almeida,2024
1,1415,8412,Early Diagnosis and Classification of Alzheimer's Disease Using Convolutional Neural Network Based on MRI Images,Salauddin Shanto; Nazmul Haque,2024
1,1415,8416,Edge-Disjoint Tree Allocation for Multi-Tenant Cloud Security in Datacenter Topologies,Jose Yallouz Ori Rottenstreich,2024
1,1415,8424,Effects of Block-Based Visual Programming on K-12 Students’ Learning Outcomes,Kun Yu Baomin Li Qing Yu,2024
1,1415,8459,Enhancing IoT Security via Automatic Network Traffic Analysis: The Transition from Machine Learning to Deep Learning,Eugeny Popko Bassem Ouni Mounia Hamidouche,2024
1,1415,8460,Enhancing Network Security Through Granular Computing: A Clustering-by-Time Approach to NetFlow Traffic Analysis,Marek Pawlicki Salvatore D'Antonio Rafał Kozik + 2 Mikołaj Komisarek,2024
1,1415,8466,Enhancing intrusion detection: a hybrid machine and deep learning approach,Kaleem Razzaq Malik Ahmad Almogren Tauqeer Safdar Malik Ali Haider Khan Jawad Tanveer Muhammad Sajid; Ateeq Ur Rehman,2024
1,1415,8475,Evaluating the Use of ChatGPT by University and High School Students,Judit Sörfőző Szügyi; Edit Szügyi; Márta Takács,2024
1,1415,8487,Exploring Computational Thinking Perspectives in Black Communities with Physiological Computing,Myles Lewis; Amanda Holloman; Bryan Y. Hernández Cuevas; Chris Crawford,2024
1,1415,8492,Exploring Gender Differences in Computational Thinking Among K-12 Students: A Meta-Analysis Investigating Influential Factors,Linlin Hu,2024
